{
  "capabilities": [],
  "content_hash": "b316e820aa088d5f7ff64a3a1bb8752bb2760f015427891cbc28c99538981339",
  "evidence_hash": "11e08bf15f6ae5e3416f8684045e6767c938ca1cb66054ac722477fb67cfce91",
  "findings": [
    {
      "description": "Synthesis: SAFE at score 100/100. no injection findings and score 100 >= safe threshold 70 -> SAFE (policy row 7)",
      "evidence": "policy.decide over stage1+stage2 findings",
      "severity": "LOW",
      "stage": 3
    }
  ],
  "recommendation": "ALLOW",
  "risk": "none",
  "score": 100,
  "skill_id": "org.stellar.skills.standards.ecosystem",
  "spec_version": "1.0.0",
  "verdict": "SAFE",
  "version": "2026.8.31"
}
