{
  "capabilities": [],
  "content_hash": "528ad44c3b6e9f78a70415e60a41a4e4a4226c488e9833a7ab8790f006a8f22b",
  "evidence_hash": "c66cc2b4b88db3d61d7dd11aa48f47ea3f1c0af5b42f18d70a786a8a0a413744",
  "findings": [
    {
      "description": "Synthesis: SAFE at score 100/100. no injection findings and score 100 >= safe threshold 70 -> SAFE (policy row 7)",
      "evidence": "policy.decide over stage1+stage2 findings",
      "severity": "LOW",
      "stage": 3
    }
  ],
  "recommendation": "ALLOW",
  "risk": "none",
  "score": 100,
  "skill_id": "org.stellar.skills.dapp.react",
  "spec_version": "1.0.0",
  "verdict": "SAFE",
  "version": "2026.8.31"
}
