{
  "capabilities": [],
  "content_hash": "2c9804b92d6d23c1588ed0f5c838a804b6cfada210190215b1941b7da0727075",
  "evidence_hash": "0f867da1e56e55d124914b918ba7c45b15256677c910745d23ff6060dd478db4",
  "findings": [
    {
      "description": "Synthesis: SAFE at score 100/100. no injection findings and score 100 >= safe threshold 70 -> SAFE (policy row 7)",
      "evidence": "policy.decide over stage1+stage2 findings",
      "severity": "LOW",
      "stage": 3
    }
  ],
  "recommendation": "ALLOW",
  "risk": "none",
  "score": 100,
  "skill_id": "org.stellar.skills.smart-contracts.development",
  "spec_version": "1.0.0",
  "verdict": "SAFE",
  "version": "2026.8.31"
}
