{
  "capabilities": [],
  "content_hash": "f6fcdb2907ded30e75bcd61ac13263f41ad45f9921923784f77305734e69cf2b",
  "evidence_hash": "b3ef71fef076ba4b39ab610b0472fab2de089ef666ba7005c38d9b877fc19735",
  "findings": [
    {
      "description": "Synthesis: SAFE at score 100/100. no injection findings and score 100 >= safe threshold 70 -> SAFE (policy row 7)",
      "evidence": "policy.decide over stage1+stage2 findings",
      "severity": "LOW",
      "stage": 3
    }
  ],
  "recommendation": "ALLOW",
  "risk": "none",
  "score": 100,
  "skill_id": "org.stellar.skills.cross-chain.cctp",
  "spec_version": "1.0.0",
  "verdict": "SAFE",
  "version": "2026.8.31"
}
