{
  "capabilities": [],
  "content_hash": "35b7b57b9230f972f6ae6cfea72dd76855a9e27b356e90091d33b3d974e0c0c6",
  "evidence_hash": "2d526aef6b9f36668d17a5df17398bde250baf986010014a00426cec3a8d71e3",
  "findings": [
    {
      "description": "Synthesis: SAFE at score 100/100. no injection findings and score 100 >= safe threshold 70 -> SAFE (policy row 7)",
      "evidence": "policy.decide over stage1+stage2 findings",
      "severity": "LOW",
      "stage": 3
    }
  ],
  "recommendation": "ALLOW",
  "risk": "none",
  "score": 100,
  "skill_id": "org.stellar.skills.agentic-payments.mpp",
  "spec_version": "1.0.0",
  "verdict": "SAFE",
  "version": "2026.8.31"
}
