{
  "capabilities": [],
  "content_hash": "56b259a35fb9fec2ca778b391672252a502e9554ccf8c2c7d5f37d0c99d49032",
  "evidence_hash": "0e36e6fab6516e9e8140fb769aa741102d68a00937044f6dfbc3b8b7f5adce1a",
  "findings": [
    {
      "description": "Synthesis: SAFE at score 100/100. no injection findings and score 100 >= safe threshold 70 -> SAFE (policy row 7)",
      "evidence": "policy.decide over stage1+stage2 findings",
      "severity": "LOW",
      "stage": 3
    }
  ],
  "recommendation": "ALLOW",
  "risk": "none",
  "score": 100,
  "skill_id": "com.fixtures.demo.changelog-writer",
  "spec_version": "1.0.0",
  "verdict": "SAFE",
  "version": "1.0.0"
}
