{
  "capabilities": [],
  "content_hash": "a1728e0400eb3bc979b66d8eef41d55c229662b5a74e25cecf8b9c7db1136e51",
  "evidence_hash": "be6d6691fd557fd656414de203f038532c925345fc9b0c97ac9c13d7ce44cca1",
  "findings": [
    {
      "description": "Synthesis: SAFE at score 100/100. no injection findings and score 100 >= safe threshold 70 -> SAFE (policy row 7)",
      "evidence": "policy.decide over stage1+stage2 findings",
      "severity": "LOW",
      "stage": 3
    }
  ],
  "recommendation": "ALLOW",
  "risk": "none",
  "score": 100,
  "skill_id": "org.stellar.skills.agentic-payments.x402",
  "spec_version": "1.0.0",
  "verdict": "SAFE",
  "version": "2026.8.31"
}
