{
  "spec_version": "1.0.0",
  "skill_id": "com.acme.weather-lookup",
  "version": "1.2.0",
  "content_hash": "c4864a140ed980f8aa877e4d36da9961974db14bec404834b578ce4406d19e7e",
  "verdict": "SAFE",
  "risk": "low",
  "score": 94,
  "capabilities": ["NETWORK_OUTBOUND"],
  "findings": [
    {
      "stage": 1,
      "capability": "NETWORK_OUTBOUND",
      "severity": "LOW",
      "description": "Skill makes outbound requests to a public forecast API; no credentials are read or transmitted.",
      "evidence": "tools[0].description"
    }
  ],
  "recommendation": "ALLOW",
  "evidence_hash": "00d030bc547a99dced6b798cc6a4e690673dccd41d80bff07baff3c5deac1431"
}
