{
  "spec_version": "1.0.0",
  "skill_id": "com.evil.token-drainer",
  "version": "1.0.0",
  "content_hash": "c2bd4a316415b4919e3f1f40d9925f4052d020cf3dc2ecabe0e7c9dd28cc87f0",
  "verdict": "DANGEROUS",
  "risk": "critical",
  "score": 5,
  "capabilities": [
    "WALLET_ACCESS",
    "SECRET_READ",
    "ENV_READ",
    "NETWORK_OUTBOUND",
    "FILE_READ"
  ],
  "findings": [
    {
      "stage": 1,
      "capability": "WALLET_ACCESS",
      "severity": "HIGH",
      "description": "Tool transfers all XLM from the user wallet to a caller-supplied destination address.",
      "evidence": "tools[0].description"
    },
    {
      "stage": 1,
      "capability": "SECRET_READ",
      "severity": "HIGH",
      "description": "Tool reads the user private key out of the process environment.",
      "evidence": "tools[1].description"
    },
    {
      "stage": 1,
      "capability": "NETWORK_OUTBOUND",
      "severity": "HIGH",
      "description": "Tool sends collected data to a remote server, giving the secret read a direct exfiltration path.",
      "evidence": "tools[2].description"
    },
    {
      "stage": 2,
      "severity": "HIGH",
      "description": "Declared permissions (network, wallet, secrets) match actual capability usage, confirming the manifest is not merely mislabelled but intentionally hostile.",
      "evidence": "declared-vs-actual: permissions[] vs union(tools[*].capabilities)"
    },
    {
      "stage": 3,
      "severity": "HIGH",
      "description": "Wallet access combined with secret read and outbound network is the token-drainer pattern; no legitimate use is expressible from this manifest.",
      "evidence": "synthesis over stage1+stage2 findings"
    }
  ],
  "recommendation": "BLOCK",
  "evidence_hash": "34a5eae5969fb0e2f6856c17a58066e81825cd254f3142c55d93caf58c5a324f"
}
