{
  "capabilities": [
    "NETWORK_OUTBOUND"
  ],
  "content_hash": "d159b461426a5bcfd0a9b36fdad54236e4b2642033037c718ff572a37a2e85ff",
  "evidence_hash": "2b6699870f19545457e6009576fdaf5b8e58a7eabb98bb114d2f04a798030d78",
  "findings": [
    {
      "capability": "NETWORK_OUTBOUND",
      "description": "Tool 'Crypto Price Checker' declares NETWORK_OUTBOUND: This capability grants direct access to sensitive resources and cannot be fully sandboxed.",
      "evidence": "tools[0].capabilities",
      "severity": "HIGH",
      "stage": 1
    },
    {
      "description": "Synthesis: SAFE at score 90/100. no injection findings and score 90 >= safe threshold 70 -> SAFE (policy row 7)",
      "evidence": "policy.decide over stage1+stage2 findings",
      "severity": "LOW",
      "stage": 3
    }
  ],
  "recommendation": "ALLOW",
  "risk": "low",
  "score": 90,
  "skill_id": "com.fixtures.safe.price-checker",
  "spec_version": "1.0.0",
  "verdict": "SAFE",
  "version": "0.9.0"
}
