{
  "capabilities": [],
  "content_hash": "e5da489eb751e96fb30bb622602b8ab471de4898f333028aeeb7a36211d341f5",
  "evidence_hash": "32a49c073507d766c2f4199429dd8ab96693e9d1e09c5d112add2d8800fc30fb",
  "findings": [
    {
      "description": "Synthesis: SAFE at score 100/100. no injection findings and score 100 >= safe threshold 70 -> SAFE (policy row 7)",
      "evidence": "policy.decide over stage1+stage2 findings",
      "severity": "LOW",
      "stage": 3
    }
  ],
  "recommendation": "ALLOW",
  "risk": "none",
  "score": 100,
  "skill_id": "com.fixtures.demo.release-notes",
  "spec_version": "1.0.0",
  "verdict": "SAFE",
  "version": "1.0.0"
}
